{
  "$schema": "https://paperandslate.org/schemas/eom/1.0/contact-directory.schema.json",
  "canonical": "https://ecme-high.example/eom/contacts.json",
  "contacts": [
    {
      "audience": ["prospective-students", "parents-guardians"],
      "email": "admissions@ecme-high.example",
      "id": "https://ecme-high.example/id/contact/admissions",
      "organization": { "id": "https://ecme-high.example/id/school" },
      "publicationReview": {
        "expires": "2028-05-01T00:00:00Z",
        "reviewedAt": "2027-05-01T12:00:00Z",
        "status": "approved"
      },
      "role": "Admissions office",
      "telephone": "+1-555-0100",
      "type": "contact-point",
      "website": "https://ecme-high.example/admissions"
    },
    {
      "audience": ["current-students", "parents-guardians"],
      "email": "family-services@ecme-high.example",
      "id": "https://ecme-high.example/id/contact/family-services",
      "organization": { "id": "https://ecme-high.example/id/school" },
      "publicationReview": {
        "expires": "2028-05-01T00:00:00Z",
        "reviewedAt": "2027-05-01T12:00:00Z",
        "status": "approved"
      },
      "role": "Family Services",
      "type": "contact-point",
      "website": "https://ecme-high.example/family-services"
    }
  ],
  "defaultLanguage": "en-US",
  "expires": "2028-05-01T14:00:00Z",
  "extensions": { "https://fixture.example/eom/extensions/module-test": { "value": "preserved" } },
  "id": "https://ecme-high.example/eom/resource/contacts",
  "modified": "2027-05-01T14:00:00Z",
  "specification": "https://paperandslate.org/spec/eom/1.0",
  "subject": "https://ecme-high.example/id/school",
  "type": "contact-directory",
  "version": "1.0"
}
